8,11.0,PERSONALIZED HEALTH CARE INC,https://www.cnbc.com/2020/01/08/accolade-hires-banks-ahead-of-a-potential-ipo-in-2020.html,"We provide access to quality primary care, mental health support and expert medical opinions all backed by a team of clinical and benefits specialists. It's an ...",['digital']
50,11.0,DSM,https://www.psychiatry.org/psychiatrists/practice/dsm,The Diagnostic and Statistical Manual of Mental Disorders (DSM–5) is the product of more than 10 years of effort by hundreds of international experts in all ...,['personalized']
49,11.0,Jazz,https://en.wikipedia.org/wiki/Jazz,"Jazz is a music genre that originated in the African-American communities of New Orleans, Louisiana, United States, in the late 19th and early 20th ...",['digital']
192,0.0,TB12,https://tb12sports.com/,"The TB12 Method is a holistic approach to health and wellness, with a focus on performance and recovery. At the center of the TB12 Method is the concept of ...",[]
146,0.0,Valera Health,https://www.valerahealth.com/,Work with your Health Coach to find the therapist and/or doctor that's right for you · Our Valera Health secure platform provides a direct connection to your ...,[]
147,0.0,Massachusetts Bay Community College,https://www.massbay.edu/,"The most affordable college in MetroWest, offering 60 two-year associate degree and one-year certificate programs in a warm, supportive environment.",[]
195,0.0,doTERRA Wellness Advocate,https://www.doterra.com/US/en/form/find-wellness-advocate,"Find a Wellness Advocate ... If you would like to learn more about dōTERRA's Certified Pure Tested Grade essential oils or other essential oil wellness products, ...",[]
148,0.0,Physio,https://www.csp.org.uk/careers-jobs/what-physiotherapy,"Industry-leading physical therapy. Hand, back, spine, vestibular, women's health, respiratory, covid recovery, sports medicine, return to play + more.",[]
142,0.0,Jawbone,https://www.jawbone.com/,The meaning of JAWBONE is jaw; especially : mandible. How to use jawbone in a sentence.,[]
194,0.0,Ogletree Deakins,https://ogletree.com/,"Ogletree Deakins is a leading labor and employment law firm. As advocates for management, we have a reputation for legal excellence and client service.",[]
193,0.0,"CSAA Insurance Group, a AAA Insurer",https://csaa-insurance.aaa.com/,"Join your local AAA club for road and travel benefits, discounts and more. MEMBERSHIP. Is your next career move with CSAA Insurance Group? Find out.",[]
184,0.0,City of Hope,https://www.cityofhope.org/homepage,"Founded in 1913, City of Hope is a National Cancer Institute-designated comprehensive cancer center and a founding member of the National Comprehensive ...",[]
190,0.0,WebMD,https://www.webmd.com/,"The leading source for trustworthy and timely health and medical news and information. Providing credible health information, supportive community, ...",[]
189,0.0,St. John Health System,https://www.stjohnhealthsystem.com/patient-online-services/online-patient-records/st-john-online-login,St. John Online Login. If you have received an invitation and access code to St. John Online but are having difficulty completing your registration:.,[]
166,0.0,National Jewish Health,https://www.nationaljewish.org/home,"National Jewish Health is the leading respiratory hospital and offers treatment and research for pulmonary, cardiac, immune and related conditions.",[]
165,0.0,Healthcare Staffing Professionals Inc.,https://www.hsp-inc.com/,"Healthcare Staffing Professionals specialize in healthcare, IT, admin, and finance staffing throughout the United States. View our staffing positions here.",[]
171,0.0,Gateway Foundation,https://www.samhsa.gov/find-help/national-helpline,"Describes how alcohol and drug addiction affect the whole family. Explains how substance abuse treatment works, how family interventions can be ...",[]
164,0.0,Lexia Learning,https://www.lexialearning.com/,Lexia Learning provides structured literacy solutions and professional learning to 5.5 million K-12 students and their 350K educators at over 20K schools ...,[]
173,0.0,California State University - East Bay,https://www.csueastbay.edu/,"Cal State East Bay serves the Bay Area as part of the California State University system, providing access to higher education for a diverse student body.",[]
161,0.0,Quil,https://quilhealth.com/,"We help people organize and navigate their health lives in partnership with their providers, health plans and loved ones. We're shaping the future, ...",[]
160,0.0,Eagle Hill Consulting,https://www.eaglehillconsulting.com/,"Eagle Hill takes an unconventional approach to management consulting, with innovative offerings in change management, workforce planning, and more.",[]
174,0.0,American Association of Nurse Practitioners,https://www.aanp.org/,AANP is the largest and only full-service national professional membership organization for NPs of all specialties.,[]
159,0.0,Newtopia Inc.,https://www.newtopia.com/,The Newtopia Difference. Hear it from Participants. Hearts & Minds: Newtopia Testimonials ... 2022 Newtopia Inc. Facebook logo icon · Instagram logo icon ...,[]
158,0.0,Pack Health,https://packhealth.com/,Pack Health is an evidence-based patient engagement platform that changes health behaviors to close gaps in care and improve outcomes.,[]
157,0.0,Brightline,https://www.gobrightline.com/,"Live life on the bright side. Brightline high-speed-rail offers train travel in unparalleled speed, comfort, and style.",[]
155,0.0,Relias,https://www.relias.com/,"Reduce your healthcare organization's variation in care through personalized learning, performance metrics, and assessments. Learn more from Relias now!",[]
187,0.0,Western Connecticut Health Network (WCHN),https://www.nuvancehealth.org/about-us/who-we-are/accountable-care-organization-aco/western-connecticut-health-network-physician-hospital-organization-aco-inc,"Western Connecticut Health Network Physician Hospital Organization ACO, Inc ; Connecticut Family Orthopedics, PC, N ; Connecticut Neck & Back Specialists, LLC, N.",[]
151,0.0,Bind Benefits,https://www.yourbind.com/,"Join the future of health care. Bind is $0 deductible, ACA-compliant health plan solution available to employers with 51+ employees, available in all 50 ...",[]
188,0.0,Johns Hopkins Medicine International,https://www.hopkinsmedicine.org/international/,Johns Hopkins Medicine is one of the top health care systems in the world for both adult and pediatric care. We are home to dozens of world-renowned centers of ...,[]
141,0.0,VIVA HEALTH,https://www.vivahealth.com/,Viva Medicare is an HMO plan with a Medicare contract and a contract with the Alabama Medicaid Agency. Enrollment in Viva Medicare depends on contract renewal.,[]
100,0.0,Marsh McLennan Agency,https://www.marshmma.com/,Marsh McLennan Agency brings world-class resources and a consultative approach tailored to your company's specific needs..,[]
139,0.0,Myriad Genetics,https://myriad.com/,Advancing health and well-being for all women. Vital genetic insights for healthcare providers and the women who rely on them. ... Decisions empowered by genetics.,[]
33,0.0,Quebec Network for Personalized Health Care,https://www.linkedin.com/company/soins-de-sant-personnalis-s-qu-bec-personalized-health-care,Quebec Network for Personalized Health Care | 177 followers on LinkedIn. The Quebec Network for Personalized Health Care (QNPHC) is a not-for-profit ...,[]
59,0.0,Parsley Health,https://www.parsleyhealth.com/,"Through Parsley Health's member portal and clinically-proven symptom tracker, you can view your progress and access notes, health plans, test results, and in- ...",[]
52,0.0,Health 2030,https://health.gov/healthypeople,Healthy People 2030 sets data-driven national objectives to improve health and well-being over the next decade. ... Healthy People 2030 includes ...,[]
51,0.0,UMC Utrecht,https://www.umcutrecht.nl/,"Welkom bij het UMC Utrecht. We richten onze inspanningen op het gebied van zorg, onderzoek, onderwijs en het vernieuwen hiervan op zes speerpunten.",[]
47,0.0,Preventum: Personalized Health Care,https://ca.linkedin.com/company/preventum-personalized-health-care,"Preventum: Personalized Health Care | 22 followers on LinkedIn. Preventum Performance utilizes medical grade analysis, removing the guesswork in caring for ...",[]
46,0.0,Philips,https://www.usa.philips.com/,"Learn more about Philips and how we help improve people's lives through meaningful innovation in the areas of Healthcare, Consumer Lifestyle and Lighting.",[]
42,0.0,Health Coach Wise,https://www.linkedin.com/company/health-coach-wise,"Health Coach Wise | 421 followers on LinkedIn. Health Coach Wise , Inc. is a company dedicated to optimal health. We work with individuals and groups all ...",[]
41,0.0,Health Hatch,https://www.instagram.com/healthhatch/?hl=en,"Health Hatch. Health & wellness website. Celebrity Dietitian, Weightloss, Diabetes & PCOS expert | Online Diet Programs |  Happy Clients in 36+ ...",[]
38,0.0,The Ohio State University Wexner Medical Center,https://wexnermedical.osu.edu/,The Ohio State Wexner Medical Center is a leader in central Ohio for healthcare and medical research. With a variety of services and locations throughout ...,[]
37,0.0,Brookdale,https://www.brookdalecc.edu/,"Brookdale Community College, located in Lincroft, New Jersey, is ranked in the top 3% of community colleges in the nation!",[]
36,0.0,Spectrum Health,https://www.spectrumhealth.org/,"Spectrum Health, based in Grand Rapids MI, is an integrated health system with teams of nationally recognized doctors and providers.",[]
35,0.0,Health Highway,https://www.healthcarehighways.com/,"At Healthcare Highways we are restoring competition to the healthcare marketplace. Learn how our Custom, value-based healthcare solutions can work for you.",[]
34,0.0,Roche,https://www.roche.com/,"As a pioneer in healthcare, we have been committed to improving lives since the company was founded in 1896 in Basel, Switzerland. Today, Roche creates ...",[]
28,0.0,Humana,https://www.humana.com/,"Find the health insurance plan to fit your needs from Humana. Turning 65? You can sign up for Medicare coverage! Start with healthy, start with Humana.",[]
138,0.0,Armor Health,https://armorhealthcare.com/,"Partnering to improve health care outcomes, provide ongoing support for patients and foster the wellness and wellbeing of the populations we serve.",[]
27,0.0,Health Right India,https://www.orfonline.org/expert-speak/declaring-the-right-to-health-a-fundamental-right/,"The Constitution of India does not expressly guarantee a fundamental right to health. However, there are multiple references in the Constitution ...",[]
23,0.0,Health Lane Family Pharmacy Sdn Bhd,https://healthlane.com.my/,"Health Lane Family Pharmacy is a well-established and growing chain of pharmacy with more than 30 years experience! Over 100 outlets in Malaysia, ...",[]
22,0.0,Health Sciences North Research Institute/L’Institut de recherches d’Horizon Santé-Nord,https://ca.linkedin.com/company/hsnri,"Health Sciences North Research Institute/L'Institut de recherches d'Horizon Santé-Nord. Research Services. Sudbury, Ontario 630 followers. See jobs Follow.",[]
20,0.0,Health for People,"https://www.linkedin.com/company/health-for-people#:~:text=Health%20for%20People%20(H4P)%20is,education%20and%20personalized%20care%20management.",Healthy People 2030 sets data-driven national objectives to improve health and well-being over the next decade. ... Healthy People 2030 includes ...,[]
19,0.0,IT Health Fusion,https://login.healthfusion.com/,Log-in to HealthFusion MediTouch here! You're always just an internet connection away from accessing all your data with the MediTouch cloud-based system.,[]
18,0.0,Health Management Corporation,https://www.linkedin.com/company/health-management-corporation,HMC is taking health care to a higher level by helping you improve and maintain the health and wellness of your total population with a comprehensive suite ...,[]
17,0.0,Health & Wellness Coach,https://nbhwc.org/,The NBHWC is leading the advancement of health & wellness coaching by establishing professional standards and collaborative partnerships.,[]
16,0.0,Health-RI,https://health.ri.gov/,State of Rhode Island: Department of Health.,[]
14,0.0,"Health Solutions (now Interactive Health, Inc.)",https://www.linkedin.com/company/health-solutions,Interactive Health (www.interactivehealthinc.com) is the leading provider of outcomes-based health management solutions designed to engage employees in the ...,[]
13,0.0,Health in Code Group,https://healthincode.com/en/,"Research is one of our priorities at Health in Code. Our team participates in international studies, with all manner of professionals, in order to expand ...",[]
11,0.0,Curtis Personalized Health Management Limited,https://curtishealth.com/,Curtis Health is the most established workplace wellness service organization in the Vancouver area since 1985 offering corporate health & wellness services.,[]
3,0.0,Health Alliance Plan,https://www.hap.org/,"Affordable Michigan health insurance plans for individuals, families, employer groups and Medicare and Medicaid members.",[]
68,0.0,Interactive Health,https://www.linkedin.com/company/interactive-health-inc,"Interactive Health (www.interactivehealthinc.com), the country's leading provider of health management solutions, creates innovative wellness programs ...",[]
69,0.0,Penn State Health,https://www.pennstatehealth.org/,Penn State Health is a multi-hospital health system serving patients and communities across central Pennsylvania.,[]
70,0.0,Priority Health,https://www.priorityhealth.com/,"Affordable, award-winning health insurance plans for Michigan individuals, families, employer groups, and Medicare and Medicaid members. Enroll today!",[]
72,0.0,LifeStance Health,https://lifestance.com/,LifeStance Health's family of behavioral health brands offer online psychiatry and therapy services across the US. Most major insurances accepted!,[]
136,0.0,Yale New Haven Health,https://www.ynhhs.org/,"Connecticut's leading healthcare system. Offering comprehensive, family-focused services in more than 100 specialties – with the greatest of care.",[]
134,0.0,Carson Tahoe Health,https://www.carsontahoe.com/,"Carson Tahoe Health is a comprehensive healthcare network featuring two hospitals, two urgent cares, an emergent care center, outpatient services and a ...",[]
132,0.0,VSP Vision Care,https://www.vsp.com/,"VSP members receive great care and more value at a Premier Program location, which is part of our incredible network of highly knowledgeable doctors. All ...",[]
131,0.0,Flywheel Sports,https://www.instagram.com/flywheelsports/?hl=en,"Flywheel Sports. Community. We've been delivering fun, results-driven indoor cycling & precision training classes since 2010 #NeverCoast New FLY Merch.",[]
130,0.0,"Emulate, Inc.",https://emulatebio.com/,Next generation advanced in vitro models from Emulate empower researchers to emulate biology and predict human response. Get started today.,[]
129,0.0,Elation Health,https://www.elationhealth.com/,"In primary care today, physicians face unsustainable pressure to balance patient care with compliance & documentation requirements. Elation alleviates that ...",[]
123,0.0,Brown & Brown,https://www.bbinsurance.com/,"Brown & Brown, Inc. has proudly offered a comprehensive range of insurance services and solutions since 1939. Publicly traded since 1993, we are listed on the ...",[]
122,0.0,Metagenics,https://www.metagenics.com/,Metagenics partners with functional and integrative health care providers to improve patient health through personalized lifestyle medicine and high-quality ...,[]
115,0.0,University of Northern Colorado,https://www.unco.edu/,"UNC offers more than 200 undergraduate, graduate, extended campus and online programs, designed to help you pursue your goals and find your path with expert ...",[]
112,0.0,Abrazo Health,https://www.abrazohealth.com/home,"About Abrazo Health. Abrazo Health offers a wide range of services across the greater Phoenix area through its hospitals, emergency centers and primary care and ...",[]
110,0.0,Emerald Health Services,https://www.emeraldhs.com/,Emerald Health Services is a travel nursing and allied healthcare recruiting agency that's been going above and beyond to curate life-changing experiences for ...,[]
109,0.0,Assurex Health,https://genesight.com/,GeneSight Psychotropic is a pharmacogenomic test that analyzes clinically important genetic variations in your DNA. The results of the test can inform your ...,[]
106,0.0,"Accolade, Inc.",https://www.accolade.com/,"Exceptional healthcare delivered by humans. Not bots. With Accolade, your people and their families are treated like individuals. We provide access to quality ...",[]
104,0.0,Color,https://www.color.com/,"A complete platform for healthcare delivery. From population genomics programs to high-throughput COVID-19 testing, Color provides the technology and ...",[]
99,0.0,Augusta Health,https://www.augustahealth.com/,"Nestled in Virginia's beautiful Shenandoah Valley, Augusta Health is among the finest community hospitals in America.",[]
93,0.0,Cityblock Health,https://www.cityblock.com/,Cityblock works with you and your insurance provider to address gaps in your current care. We then split the cost savings that come with better care with your ...,[]
92,0.0,Genomic Health,https://online.genomichealth.com/,Physician Portal · Exact Sciences Corporation · OncotypeIQ · Submit a Patient Case (Breast or Colon—US only).,[]
90,0.0,Clover Health,https://www.cloverhealth.com/en/,Clover Health is a Preferred Provider Organization (PPO) and a Health Maintenance Organization (HMO) with a Medicare contract. Enrollment in Clover Health ...,[]
89,0.0,"Persona, a Nestlé Health Science company",https://www.linkedin.com/company/personanutrition,"Persona, a Nestlé Health Science company | 9964 followers on LinkedIn. Daily Vitamin Packs Personalized for YOU! | Persona delivers the simplicity and ...",[]
87,0.0,Greenville Health System,https://www.prismahealth.org/,"As South Carolina's largest private, non-profit healthcare system, Prisma Health is here to create a better state of health for South Carolinians.",[]
86,0.0,Circadia Health,https://circadia.health/,"Enabling early detection of respiratory failure powered by contactless sensing, clinic software, and artificial intelligence.",[]
83,0.0,Propeller Health,https://propellerhealth.com/,"More than 100,000 people have trusted Propeller to help manage their asthma or COPD. · Many people experience fewer symptoms and flare-ups after just one month.",[]
81,0.0,Moda Health,https://www.modahealth.com/,"Learn about Moda Health and Delta Dental plans. Find care. Get details about benefits, claims, member resources and more.",[]
79,0.0,El Camino Health,https://www.elcaminohealth.org/,"El Camino Health includes two not-for-profit acute care hospitals in Los Gatos and Mountain View and urgent care, multi-specialty care and primary care ...",[]
74,0.0,Grand Rounds Health,https://grandrounds.com/,"We're here to find you a doctor, tackle a bill or explain your insurance benefits. And thanks to your employer, it won't cost you a thing.",[]
199,0.0,Vincennes University,https://www.vinu.edu/,Founded in 1801 VU is Indiana's first college making your degree widely recognized by top employers! Vincennes is a vibrant city rich with culture and history.,[]
12,,HEALTH[at]SCALE Technologies,https://www.healthatscale.com/,"Personalized. Predictive. · Team. Founded and led by top machine learning and clinical faculty and industry experts from MIT, Harvard, Stanford, U-Michigan and ...",
177,,VMS BioMarketing,https://www.vmsbiomarketing.com/,"VMS BioMarketing is a leading provider of Clinical Educator solutions focused on empowering healthcare providers and patients through product support, ...",
