Song Name,Artist,Importance Score,Number of Cities where Song Broke Top20,List of Cities where Song Broke Top20,Broke USTop20 Charts,Aberdeen-SD,Aberdeen-WA,Abilene,Akron,Albany,Albuquerque,Allentown,Anaheim,Anchorage,Asheville,Atlanta,Aurora,Austin,Bakersfield,Baltimore,Barnstable,Baton-Rouge,Bellingham,Belvidere,Bend,Billings,Birmingham,Bismarck,Boise,Boston,Brentwood-NY,Bridgeport,Brockton,Brooklyn,Brownsville,Buffalo,Cape-Coral,Casper,Cedar-Rapids,Centreville,Charleston,Charlotte,Cheyenne,Chicago,Chico,Cincinnati,Clarksville-TN,Cleveland,Colorado-Springs,Columbia,Columbus,Concord-CA,Coram-NY,Coventry-RI,Crystal-Lake,Dale-City-VA,Dallas,Davenport,Dayton,Denver,Detroit,Dodge-City,Douglas-GA,Duluth,Dumas,El-Paso,Elgin,Erie,Eugene,Evanston,Fairbanks,Fairfield,Fargo,Fayetteville-AR,Fort-Lauderdale,Fort-Worth,Freeport-FL,Fremont-CA,Fresno,Grand-Island,Grand-Junction,Grand-Rapids,Great-Falls,Green-Bay,Greensboro,Greenville,Hammond-IN,Hanover-PA,Hartford,Hilo,Honolulu,Houston,Idaho-Falls,Indianapolis,Jackson,Jacksonville,Joliet,Juneau,Kansas-City,Keene-NH,Kennewick,Killeen,Knoxville,Lansing,Laredo,Las-Vegas,Lewiston,Little-Rock,Los-Angeles,Louisville,Lubbock,Macon,Madison,Manhattan,Mansfield-City,Marquette,McAllen,Memphis,Mesa,Miami,Milford-DE,Milwaukee,Minneapolis,Missoula,Mobile,Modesto,Nashville,New-Haven,New-Orleans,New-Ulm-MN,New-York-City,Norfolk,North-Platte,Norwich,Oakland,Ogden,Oklahoma-City,Omaha,Oneonta,Orlando,Oxnard,Philadelphia,Phoenix,Pine-Bluff,Pittsburgh,Pittsfield,Pocatello,Port-Angeles,Port-Saint-Lucie,Portland,Providence,Provo,Pueblo,Raleigh,Rapid-City,Reading,Reno,Richmond,Riverside,Rochester,Rockford,Rome,Sacramento,Saint-Cloud,Saint-Paul,Salinas,Salt-Lake-City,San-Antonio,San-Diego,San-Francisco,San-Jose,Santa-Barbara,Sarasota,Scranton,Seattle,Shreveport,Sioux-Falls,South-Boston,Spokane,Springfield-IL,Springfield-MA,Springfield-MO,St.-Louis,Stockton,Syracuse,Tacoma,Tallahassee,Tampa,The-Woodlands-TX,Thousand-Oaks,Toms-River,Tracy-CA,Trenton,Tucson,Tulsa,Twin-Falls,Tyler,Virginia-Beach,Warren-OH,Washington-D.C.,Wichita,Wilmington,Woonsocket,Worcester,Yakima,Youngstown,Yuma
Right On Time,Brandi Carlile,134.3118811881188,72,"Albany, Allentown, Asheville, Austin, Baltimore, Barnstable, Bellingham, Bend, Billings, Bismarck, Boise, Boston, Brentwood-NY, Bridgeport, Brockton, Cape-Coral, Charleston, Chico, Cincinnati, Cleveland, Colorado-Springs, Columbus, Coram-NY, Crystal-Lake, Davenport, Dayton, Denver, Dodge-City, Duluth, Erie, Eugene, Fargo, Fayetteville-AR, Grand-Island, Greensboro, Indianapolis, Joliet, Juneau, Kansas-City, Keene-NH, Knoxville, Lansing, Louisville, Madison, Milwaukee, Minneapolis, Missoula, Nashville, Norwich, Oklahoma-City, Philadelphia, Pine-Bluff, Pittsburgh, Pocatello, Portland, Providence, Provo, Raleigh, Reading, Rochester, Saint-Cloud, Sarasota, Seattle, Spokane, Springfield-MO, St.-Louis, Thousand-Oaks, Trenton, Tulsa, Warren-OH, Worcester, Youngstown",False,,,,,3.0,,9.0,,,8.0,,,13.0,,19.0,8.0,,18.0,,12.0,13.0,,9.0,11.0,8.0,8.0,15.0,4.0,,,,16.0,,,,17.0,,,,4.0,9.0,,14.0,17.0,,9.0,,6.0,,5.0,,,14.0,16.0,11.0,,14.0,,1.0,,,,15.0,10.0,,,,6.0,8.0,,,,,,13.0,,,,,11.0,,,,,,,,,15.0,,,7.0,16.0,11.0,3.0,,,16.0,12.0,,,,,,19.0,,,2.0,,,,,,,,,7.0,2.0,8.0,,,9.0,,,,,,,8.0,,,15.0,,,,,13.0,,9.0,2.0,,12.0,,,10.0,3.0,8.0,,8.0,,15.0,,,,4.0,,,,11.0,,,,,,,,,18.0,,18.0,,,,19.0,,,5.0,7.0,,,,,,,6.0,,,11.0,,6.0,,,,6.0,,,,,8.0,,18.0,
Knife Talk [Mixed],Drake Feat. 21 Savage & Project Pat,142.3910891089109,64,"Akron, Anchorage, Atlanta, Austin, Bakersfield, Baton-Rouge, Belvidere, Birmingham, Bismarck, Brownsville, Charleston, Charlotte, Clarksville-TN, Cleveland, Columbia, Dallas, Detroit, El-Paso, Elgin, Fairfield, Fort-Worth, Freeport-FL, Fresno, Grand-Junction, Houston, Jackson, Killeen, Knoxville, Laredo, Las-Vegas, Lubbock, Macon, McAllen, Memphis, Mesa, Milford-DE, Mobile, Modesto, New-Orleans, Ogden, Oklahoma-City, Oneonta, Phoenix, Pittsburgh, Port-Angeles, Pueblo, Reno, Richmond, Riverside, Rome, Sacramento, San-Antonio, Shreveport, Springfield-IL, Stockton, Tallahassee, Tampa, The-Woodlands-TX, Tucson, Tulsa, Tyler, Virginia-Beach, Wichita, Yuma",False,,,,14.0,,,,,18.0,,13.0,,12.0,20.0,,,9.0,,20.0,,,9.0,14.0,,,,,,,16.0,,,,,,18.0,16.0,,,,,11.0,8.0,,14.0,,,,,,,20.0,,,,13.0,,,,,9.0,15.0,,,,,12.0,,,,8.0,11.0,,10.0,,11.0,,,,,,,,,,,5.0,,,15.0,,,,,,,5.0,15.0,,3.0,11.0,,,,,6.0,19.0,,,,,6.0,12.0,6.0,,10.0,,,,10.0,13.0,,,3.0,,,,,,,16.0,9.0,,3.0,,,,9.0,,20.0,,,11.0,,,,,19.0,,,,5.0,16.0,19.0,,,11.0,12.0,,,,,7.0,,,,,,,,7.0,,,,10.0,,,,16.0,,,11.0,15.0,3.0,,,,,10.0,15.0,,12.0,9.0,,,10.0,,,,,,14.0
For Tonight,GIVĒON,151.81683168316832,54,"Anchorage, Asheville, Atlanta, Baton-Rouge, Birmingham, Casper, Charleston, Charlotte, Clarksville-TN, Columbia, Davenport, Detroit, Duluth, Elgin, Fargo, Fort-Lauderdale, Fresno, Grand-Rapids, Green-Bay, Greensboro, Greenville, Honolulu, Indianapolis, Jackson, Jacksonville, Kansas-City, Knoxville, Lansing, Lewiston, Louisville, Lubbock, Memphis, Milford-DE, Minneapolis, Mobile, Modesto, Nashville, New-Orleans, Ogden, Orlando, Port-Saint-Lucie, Raleigh, Richmond, Rockford, Rome, Sacramento, Shreveport, Springfield-IL, Stockton, Tallahassee, Tampa, Tulsa, Tyler, Wichita",False,,,,,,,,,4.0,14.0,18.0,,,,,,12.0,,,,,5.0,,,,,,,,,,,16.0,,,13.0,5.0,,,,,12.0,,,5.0,,,,,,,,11.0,,,16.0,,,3.0,,,10.0,,,,,,2.0,,15.0,,,,8.0,,,12.0,,3.0,2.0,8.0,,,,,10.0,,,9.0,10.0,20.0,,,16.0,,,,10.0,18.0,,,15.0,,,10.0,15.0,,,,,,,8.0,,,15.0,,9.0,,8.0,10.0,16.0,,10.0,,,,,,,17.0,,,,15.0,,,,,,,,,12.0,,,,,9.0,,,,13.0,,,7.0,2.0,18.0,,,,,,,,,,,,,17.0,,,,13.0,,,,11.0,,,17.0,18.0,,,,,,,16.0,,18.0,,,,17.0,,,,,,
Meet Me At Our Spot,"THE ANXIETY, WILLOW & Tyler Cole",153.24257425742573,53,"Aberdeen-SD, Abilene, Albuquerque, Allentown, Billings, Boise, Cedar-Rapids, Chicago, Clarksville-TN, Crystal-Lake, Davenport, Dodge-City, Duluth, Elgin, Erie, Eugene, Fairfield, Fayetteville-AR, Grand-Junction, Grand-Rapids, Hanover-PA, Hilo, Idaho-Falls, Indianapolis, Jacksonville, Joliet, Kansas-City, Keene-NH, Lansing, Manhattan, Marquette, Mesa, Norwich, Ogden, Oxnard, Phoenix, Pocatello, Rapid-City, Reno, Rochester, Rockford, Saint-Cloud, Seattle, Sioux-Falls, Spokane, Springfield-MO, Tacoma, Tucson, Tulsa, Twin-Falls, Wichita, Yakima, Yuma",False,15.0,,15.0,,,19.0,11.0,,,,,,,,,,,,,,3.0,,,17.0,,,,,,,,,,10.0,,,,,19.0,,,20.0,,,,,,,,10.0,,,7.0,,,,8.0,,12.0,,,17.0,13.0,13.0,,,13.0,,16.0,,,,,,,8.0,15.0,,,,,,14.0,,11.0,,,13.0,18.0,,19.0,16.0,,15.0,8.0,,,,20.0,,,,,,,,,,10.0,,20.0,,,17.0,,,,,,,,,,,,,,,20.0,,9.0,,,,,19.0,,18.0,,,,2.0,,,,,,,,9.0,,18.0,,,20.0,14.0,,,4.0,,,,,,,,,,,20.0,,3.0,,18.0,,,15.0,,,,9.0,,,,,,,,15.0,14.0,19.0,,,,,4.0,,,,8.0,,8.0
Beggin,Måneskin,157.8861386138614,48,"Aberdeen-SD, Aberdeen-WA, Akron, Anaheim, Barnstable, Bend, Billings, Brockton, Casper, Chicago, Chico, Coram-NY, Crystal-Lake, Evanston, Fairbanks, Freeport-FL, Great-Falls, Green-Bay, Hanover-PA, Hilo, Joliet, Kennewick, Lewiston, Manhattan, Mansfield-City, Marquette, Milford-DE, New-Haven, North-Platte, Norwich, Oklahoma-City, Omaha, Orlando, Oxnard, Port-Saint-Lucie, Portland, Providence, Pueblo, Rockford, Shreveport, Spokane, Springfield-MA, Springfield-MO, Tacoma, Twin-Falls, Wichita, Worcester, Youngstown",False,7.0,9.0,,20.0,,,,14.0,,,,,,,,17.0,,,,3.0,19.0,,,,,,,12.0,,,,,6.0,,,,,,17.0,18.0,,,,,,,,12.0,,9.0,,,,,,,,,,,,,,,14.0,6.0,,,,,,13.0,,,,,,15.0,13.0,,,,13.0,,18.0,,,,,,,19.0,,,,10.0,,,,,,16.0,,,,,,,15.0,1.0,15.0,,,,,20.0,,,,,,,13.0,,,,,20.0,15.0,,,20.0,20.0,,11.0,18.0,,,,,,,,18.0,11.0,14.0,,9.0,,,,,,,,6.0,,,,,,,,,,,,,,,15.0,,,8.0,,16.0,13.0,,,,8.0,,,,,,,,,,12.0,,,,,20.0,,,3.0,,10.0,
